{
  "task_id": "ops-0041",
  "project_id": "rook-workspace",
  "title": "Dispatcher: PR merge detection — auto-transition review task to done",
  "description": "When a task reaches `review` status, `validateStageCompletion()` blocks advancement until `github_pull_request.state === 'merged'`. But nothing currently detects the merge and transitions the task. Marcus has to manually update the canonical file or the task stays blocked in review forever.\n\nFix: in `inspectActiveHookClaims()`, for tasks with `status === 'review'` and `github_pull_request.number` set, call `gh pr view <number> --repo <repo> --json state,mergedAt` and if `state === 'MERGED'`, update the task:\n- Set `status: done`, `workflow_stage: done`\n- Set `github_pull_request.state: merged`, `last_synced_at: now`\n- Set `timestamps.completed_at: mergedAt`\n- Write to both runtime state and canonical task file\n- Send lifecycle notification\n\nScope: only check PRs for tasks that have been in review for > 5 minutes (avoid immediate re-check on dispatch). Use `runGh()` already available in the dispatcher.",
  "status": "ready",
  "assigned_agent": "engineer",
  "priority": "high",
  "dependencies": [],
  "related_repo": "MarcusGraetsch/rook-workspace",
  "branch": "agent/engineer/ops-0041-pr-merge-auto-done",
  "labels": ["dispatcher", "github", "automation"],
  "workflow_stage": "ready",
  "blocked_reason": null,
  "failure_reason": null,
  "handoff_notes": "",
  "commits": [],
  "commit_refs": [],
  "artifacts": [],
  "github_issue": {
    "repo": "MarcusGraetsch/rook-workspace",
    "number": null,
    "url": null,
    "state": null,
    "sync_status": "not_requested",
    "last_synced_at": null,
    "last_error": null
  },
  "timestamps": {
    "created_at": "2026-04-19T06:16:43Z",
    "updated_at": "2026-04-19T06:16:43Z",
    "started_at": null,
    "completed_at": null,
    "claimed_at": null
  }
}
